{
  "schema_version": "1.0",
  "kind": "kag_promotion_metrics",
  "id": "kag_promotion_metrics.example",
  "status": "candidate",
  "summary": "Example kag_promotion_metrics object for v0.6 federation harvest seed.",
  "owner_repo": "aoa-stats",
  "evidence_refs": [
    "receipt://v0.6/kag_promotion_metrics/example"
  ],
  "payload": {
    "kag_candidates": 2,
    "promoted": 1,
    "blocked": 1
  }
}
